{
  "schema_version": "1.0",
  "knowledge_object_type": "grep_rule",
  "id": "grep-passport-retention-red-flag-example",
  "version": "v1",
  "provenance": {
    "created_at": "2026-07-21T00:00:00Z",
    "created_by": "contributor-node-example",
    "content_sha256": "d18bda647497f8ca43b5066c3717094aa57f253e2e444a675ceee73081626534",
    "vetted": false
  },
  "content": {
    "pattern": "(?i)\b(passport|identity document|id card)\b.{0,40}(held|kept|confiscated|surrendered|retained|took|not returned)",
    "label": "Employer or recruiter retains worker identity documents",
    "ilo_indicator": "Retention of identity documents",
    "ilo_reference": "ILO Forced Labour Convention C029; ILO indicator of forced labour - retention of identity documents",
    "severity": "high",
    "explanation": "A recruiter or employer holding, confiscating, or refusing to return a worker's passport or national ID is a recognized ILO forced-labour indicator. It restricts freedom of movement and is a common control tactic in labor trafficking.",
    "example_match": "The agency said they would hold my passport until the contract ends.",
    "suggested_action": "Surface an ILO-grounded warning, explain the worker's right to keep their own documents, and offer local hotline referrals from a vetted NGO directory pack.",
    "false_positive_notes": "Legitimate contexts exist (a hotel briefly holding a passport at check-in, routine visa processing). Treat this as a signal to investigate, not a conclusion."
  },
  "tags": [
    "ilo-indicator",
    "document-retention",
    "recruitment",
    "synthetic-example"
  ],
  "extensions": {
    "contributed_via": "examples/contribute_knowledge/submit_knowledge.py",
    "composite_synthetic": true,
    "notes": "Composite, synthetic knowledge object for documentation and round-trip testing. No real person, case, or organization."
  }
}
